{
  "$schema": "https://raw.githubusercontent.com/half144/ps5-react/main/app.schema.json",
  "titleId": "PPSA99058",
  "contentId": "UP9000-PPSA99058_00-OVERDRIVE0000000",
  "name": "TRAPSTARSHOP",
  "version": "01.013.000",
  "render": { "width": 1920, "height": 1080 },
  "surface": { "width": 1920, "height": 1080 },
  "refreshRate": 60,
  "textFonts": ["chinese", "chinese-traditional", "japanese", "bengali", "devanagari", "arabic"],
  "resources": ["data/releases", "data/pages", "i18n/locales"],
  "filesystemAccess": "console",
  "networking": true,
  "timeoutSeconds": 0
}
